<SavageLands xmlns="urn:savage_lands:1.0.0" xmlns:xsi="http://www.w3.org/2001/XMLSchema-instance" xsi:schemaLocation="urn:savage_lands:1.0.0 SavageLands.xsd">
	<Races>
		<Race id="1_human">
			<UserPlayable>1</UserPlayable>
			<NameSID>RACE_1_NAME</NameSID>
			<DescriptionSID>RACE_1_DESC</DescriptionSID>
			<DisplayAbbreviationSID>RACE_1_ABRV</DisplayAbbreviationSID>
			<Size>2</Size>
			<RaceInitialStatistics>
				<Strength>11</Strength>
				<Dexterity>10</Dexterity>
				<Agility>10</Agility>
				<Health>11</Health>
				<Intelligence>10</Intelligence>
				<Willpower>10</Willpower>
				<Charisma>10</Charisma>
				<Speed>50</Speed>
			</RaceInitialStatistics>
			<RaceInitialModifiers>
				<ValourModifier>5</ValourModifier>
				<SpiritModifier>5</SpiritModifier>
			</RaceInitialModifiers>
			<Resistances>
				<Slash>0.0</Slash>
				<Pierce>0.0</Pierce>
				<Pound>0.0</Pound>
				<Heat>0.0</Heat>
				<Cold>0.0</Cold>
				<Acid>0.0</Acid>
				<Poison>0.0</Poison>
				<Holy>0.0</Holy>
				<Shadow>0.0</Shadow>
				<Arcane>0.0</Arcane>
				<Mental>0.0</Mental>
				<Sonic>0.0</Sonic>
				<Radiant>0.0</Radiant>
				<Lightning>0.0</Lightning>
			</Resistances>
			<Skills>
				<GeneralSkills>
					<Boating>10</Boating>
					<Carrying>10</Carrying>
					<Detection>10</Detection>
					<Fishing>15</Fishing>
					<Foraging>15</Foraging>
					<Hiding>10</Hiding>
					<Swimming>15</Swimming>
				</GeneralSkills>
				<WeaponSkills>
					<ShortBlades>5</ShortBlades>
					<Bludgeons>5</Bludgeons>
					<Daggers>5</Daggers>
					<Spears>5</Spears>
				</WeaponSkills>
				<RangedWeaponSkills>
					<Rocks>5</Rocks>
					<Slings>5</Slings>
				</RangedWeaponSkills>
			</Skills>
			<ExperienceMultiplier>1.0</ExperienceMultiplier>		
		</Race>
		<Race id="2_woodelf">
			<UserPlayable>1</UserPlayable>
			<NameSID>RACE_2_NAME</NameSID>
			<DescriptionSID>RACE_2_DESC</DescriptionSID>
			<DisplayAbbreviationSID>RACE_2_ABRV</DisplayAbbreviationSID>
			<Size>2</Size>
			<RaceInitialStatistics>
				<Strength>8</Strength>
				<Dexterity>14</Dexterity>
				<Agility>15</Agility>
				<Health>7</Health>
				<Intelligence>13</Intelligence>
				<Willpower>10</Willpower>
				<Charisma>10</Charisma>
				<Speed>47</Speed>
			</RaceInitialStatistics>
			<RaceInitialModifiers>
				<ValourModifier>4</ValourModifier>
				<SpiritModifier>6</SpiritModifier>
			</RaceInitialModifiers>
			<Resistances>
				<Slash>0.0</Slash>
				<Pierce>0.0</Pierce>
				<Pound>0.0</Pound>
				<Heat>-0.05</Heat>
				<Cold>0.0</Cold>
				<Acid>0.0</Acid>
				<Poison>0.0</Poison>
				<Holy>0.0</Holy>
				<Shadow>0.0</Shadow>
				<Arcane>0.10</Arcane>
				<Mental>0.0</Mental>
				<Sonic>0.0</Sonic>
				<Radiant>0.0</Radiant>
				<Lightning>0.0</Lightning>
			</Resistances>
			<Skills>
				<GeneralSkills>
					<Archery>15</Archery>
					<Awareness>15</Awareness>
					<Carrying>10</Carrying>
					<Detection>10</Detection>
					<ForestLore>20</ForestLore>
					<Herbalism>10</Herbalism>
					<NightSight>15</NightSight>
					<Swimming>15</Swimming>
				</GeneralSkills>
				<WeaponSkills>
					<LongBlades>7</LongBlades>
				</WeaponSkills>
				<RangedWeaponSkills>
					<Bows>7</Bows>
				</RangedWeaponSkills>
			</Skills>
			<ExperienceMultiplier>1.05</ExperienceMultiplier>		
		</Race>
		<Race id="3_mountainelf">
			<UserPlayable>1</UserPlayable>
			<NameSID>RACE_3_NAME</NameSID>
			<DescriptionSID>RACE_3_DESC</DescriptionSID>
			<DisplayAbbreviationSID>RACE_3_ABRV</DisplayAbbreviationSID>
			<Size>2</Size>
			<RaceInitialStatistics>
				<Strength>9</Strength>
				<Dexterity>13</Dexterity>
				<Agility>12</Agility>
				<Health>11</Health>
				<Intelligence>12</Intelligence>
				<Willpower>11</Willpower>
				<Charisma>9</Charisma>
				<Speed>50</Speed>
			</RaceInitialStatistics>
			<RaceInitialModifiers>
				<ValourModifier>6</ValourModifier>
				<SpiritModifier>4</SpiritModifier>
			</RaceInitialModifiers>	
			<Resistances>
				<Slash>0.0</Slash>
				<Pierce>0.0</Pierce>
				<Pound>0.0</Pound>
				<Heat>0.0</Heat>
				<Cold>0.25</Cold>
				<Acid>-0.10</Acid>
				<Poison>-0.15</Poison>
				<Holy>0.0</Holy>
				<Shadow>0.0</Shadow>
				<Arcane>0.0</Arcane>
				<Mental>0.0</Mental>
				<Sonic>0.0</Sonic>
				<Radiant>0.0</Radiant>
				<Lightning>0.0</Lightning>
			</Resistances>
			<Skills>
				<GeneralSkills>
					<Archery>15</Archery>
					<Awareness>15</Awareness>
					<Carrying>10</Carrying>
					<Detection>10</Detection>
					<MountainLore>20</MountainLore>
					<Mountaineering>20</Mountaineering>
					<NightSight>10</NightSight>
					<Spelunking>10</Spelunking>
					<Swimming>15</Swimming>
				</GeneralSkills>
				<WeaponSkills>
					<Bludgeons>7</Bludgeons>
				</WeaponSkills>
				<RangedWeaponSkills>
					<Rocks>5</Rocks>
					<Slings>7</Slings>
				</RangedWeaponSkills>
			</Skills>
			<ExperienceMultiplier>1.02</ExperienceMultiplier>
		</Race>
		<Race id="4_marshelf">
			<UserPlayable>1</UserPlayable>
			<NameSID>RACE_4_NAME</NameSID>
			<DescriptionSID>RACE_4_DESC</DescriptionSID>
			<DisplayAbbreviationSID>RACE_4_ABRV</DisplayAbbreviationSID>
			<Size>2</Size>
			<RaceInitialStatistics>
				<Strength>7</Strength>
				<Dexterity>11</Dexterity>
				<Agility>12</Agility>
				<Health>8</Health>
				<Intelligence>14</Intelligence>
				<Willpower>14</Willpower>
				<Charisma>7</Charisma>
				<Speed>50</Speed>
			</RaceInitialStatistics>
			<RaceInitialModifiers>
				<ValourModifier>2</ValourModifier>
				<SpiritModifier>8</SpiritModifier>
			</RaceInitialModifiers>	
			<Resistances>
				<Slash>-0.05</Slash>
				<Pierce>-0.05</Pierce>
				<Pound>0.0</Pound>
				<Heat>0.0</Heat>
				<Cold>-0.15</Cold>
				<Acid>0.0</Acid>
				<Poison>0.20</Poison>
				<Holy>0.0</Holy>
				<Shadow>0.0</Shadow>
				<Arcane>0.20</Arcane>
				<Mental>0.0</Mental>
				<Sonic>0.0</Sonic>
				<Radiant>0.15</Radiant>
				<Lightning>0.0</Lightning>
			</Resistances>
			<Skills>
				<GeneralSkills>
					<Awareness>15</Awareness>
					<Boating>15</Boating>
					<Carrying>10</Carrying>
					<Detection>10</Detection>
					<MarshLore>20</MarshLore>
					<NightSight>10</NightSight>
					<Swimming>15</Swimming>
				</GeneralSkills>
				<WeaponSkills>
					<Spears>7</Spears>
				</WeaponSkills>
				<RangedWeaponSkills>
					<Spears>7</Spears>
				</RangedWeaponSkills>
			</Skills>
			<ExperienceMultiplier>1.08</ExperienceMultiplier>
		</Race>
		<Race id="5_pixie">
			<UserPlayable>1</UserPlayable>
			<NameSID>RACE_5_NAME</NameSID>
			<DescriptionSID>RACE_5_DESC</DescriptionSID>
			<DisplayAbbreviationSID>RACE_5_ABRV</DisplayAbbreviationSID>
			<Size>0</Size>
			<RaceInitialStatistics>
				<Strength>5</Strength>
				<Dexterity>14</Dexterity>
				<Agility>17</Agility>
				<Health>6</Health>
				<Intelligence>17</Intelligence>
				<Willpower>12</Willpower>
				<Charisma>10</Charisma>
				<Speed>45</Speed>
			</RaceInitialStatistics>
			<RaceInitialModifiers>
				<ValourModifier>0</ValourModifier>
				<SpiritModifier>10</SpiritModifier>
			</RaceInitialModifiers>	
			<Resistances>
				<Slash>-0.05</Slash>
				<Pierce>-0.05</Pierce>
				<Pound>-0.05</Pound>
				<Heat>0.05</Heat>
				<Cold>0.05</Cold>
				<Acid>-0.15</Acid>
				<Poison>-0.10</Poison>
				<Holy>0.10</Holy>
				<Shadow>0.10</Shadow>
				<Arcane>0.25</Arcane>
				<Mental>0.0</Mental>
				<Sonic>0.0</Sonic>
				<Radiant>0.20</Radiant>
				<Lightning>0.10</Lightning>
			</Resistances>
			<Skills>
				<GeneralSkills>
					<Awareness>15</Awareness>
					<Carrying>10</Carrying>
					<Detection>10</Detection>
					<Escape>20</Escape>
					<ForestLore>25</ForestLore>
					<Herbalism>10</Herbalism>
					<Magic>15</Magic>
					<NightSight>15</NightSight>
					<Stealth>15</Stealth>
				</GeneralSkills>
				<WeaponSkills>
					<Daggers>5</Daggers>
				</WeaponSkills>
			</Skills>
			<ExperienceMultiplier>1.13</ExperienceMultiplier>
		</Race>
		<Race id="6_dwarf">
			<UserPlayable>1</UserPlayable>
			<NameSID>RACE_6_NAME</NameSID>
			<DescriptionSID>RACE_6_DESC</DescriptionSID>
			<DisplayAbbreviationSID>RACE_6_ABRV</DisplayAbbreviationSID>			
			<Size>1</Size>
			<RaceInitialStatistics>
				<Strength>14</Strength>
				<Dexterity>9</Dexterity>
				<Agility>8</Agility>
				<Health>13</Health>
				<Intelligence>9</Intelligence>
				<Willpower>12</Willpower>
				<Charisma>8</Charisma>
				<Speed>50</Speed>
			</RaceInitialStatistics>
			<RaceInitialModifiers>
				<ValourModifier>8</ValourModifier>
				<SpiritModifier>2</SpiritModifier>
			</RaceInitialModifiers>	
			<Resistances>
				<Slash>0.0</Slash>
				<Pierce>0.0</Pierce>
				<Pound>0.05</Pound>
				<Heat>0.1</Heat>
				<Cold>0.0</Cold>
				<Acid>0.0</Acid>
				<Poison>0.0</Poison>
				<Holy>0.0</Holy>
				<Shadow>0.0</Shadow>
				<Arcane>-0.10</Arcane>
				<Mental>0.0</Mental>
				<Sonic>0.0</Sonic>
				<Radiant>0.0</Radiant>
				<Lightning>0.0</Lightning>
			</Resistances>
			<Skills>
				<GeneralSkills>
					<Carrying>10</Carrying>
					<Detection>10</Detection>
					<DisarmTraps>10</DisarmTraps>
					<MountainLore>20</MountainLore>
					<NightSight>15</NightSight>
					<Smithing>20</Smithing>
					<Spelunking>20</Spelunking>
				</GeneralSkills>
				<WeaponSkills>
					<Axes>7</Axes>
					<Bludgeons>7</Bludgeons>
				</WeaponSkills>
				<RangedWeaponSkills>
					<Crossbows>5</Crossbows>
				</RangedWeaponSkills>
			</Skills>
			<ExperienceMultiplier>1.04</ExperienceMultiplier>
		</Race>
		<Race id="7_goblin">
			<UserPlayable>1</UserPlayable>
			<NameSID>RACE_7_NAME</NameSID>
			<DescriptionSID>RACE_7_DESC</DescriptionSID>
			<DisplayAbbreviationSID>RACE_7_ABRV</DisplayAbbreviationSID>
			<Size>1</Size>
			<RaceInitialStatistics>
				<Strength>9</Strength>